,Orthogroup,description,%conserved,Outgroup
0,OG0000183,"heat shock 70 kDa protein /heat shock protein family A (Hsp70) member 1B /heat shock cognate 71 kDa protein-like /heat shock cognate 70 /heat shock cognate 71 kDa protein-like /heat shock cognate 71 kDa protein-like /heat shock cognate 71 kDa protein-like /heat shock cognate 71 kDa protein-like /heat shock cognate 71 kDa protein-like /heat shock cognate 71 kDa protein-like /heat shock cognate 71 kDa protein-like /heat shock cognate 71 kDa protein-like /heat shock cognate 71 kDa protein-like /heat shock cognate 71 kDa protein-like /heat shock cognate 71 kDa protein-like /heat shock 70 kDa protein 1-like /heat shock protein family A (Hsp70) member 1B /Ciona intestinalis heat shock protein 70 (hsp70), mRNA. /heat shock cognate 70-kd protein, tandem duplicate 3 /heat shock 70 kDa protein-like /heat shock 70 kDa protein-like /heat shock cognate 70-kd protein, tandem duplicate 1 /heat shock cognate 71 kDa protein-like /heat shock protein family A (Hsp70) member 8 /heat shock protein family A (Hsp70) member 8 /heat shock protein family A (Hsp70) member 8 /heat shock protein family A (Hsp70) member 8b /heat shock protein family A (Hsp70) member 8b /heat shock protein family A (Hsp70) member 8b /heat shock protein family A (Hsp70) member 8b /heat shock protein family A (Hsp70) member 8b /heat shock protein family A (Hsp70) member 8b /heat shock protein family A (Hsp70) member 8b /heat shock protein family A (Hsp70) member 8b /heat shock protein family A (Hsp70) member 8b /heat shock cognate 70 /heat shock cognate 70 /heat shock cognate 70-kd protein, tandem duplicate 1 /heat shock protein family A (Hsp70) member 1B /heat shock cognate 71 kDa protein-like /heat shock cognate 71 kDa protein-like /heat shock cognate 71 kDa protein-like /heat shock cognate 71 kDa protein-like /heat shock cognate 71 kDa protein-like /heat shock cognate 70 /heat shock 70 kDa protein-like /heat shock 70 kDa protein-like /heat shock 70 kDa protein-like /heat shock 70 kDa protein-like /heat shock 70 kDa protein-like /heat shock 70 kDa protein-like /heat shock 70 kDa protein-like /heat shock 70 kDa protein-like /heat shock 70 kDa protein-like /heat shock 70 kDa protein-like /heat shock 70 kDa protein /heat shock protein family A (Hsp70) member 1B /heat shock cognate 70 /heat shock cognate 70 /heat shock cognate 70 /heat shock cognate 71 kDa protein-like /heat shock cognate 71 kDa protein-like /heat shock cognate 71 kDa protein-like /heat shock cognate 71 kDa protein-like /heat shock cognate 71 kDa protein-like /heat shock cognate 71 kDa protein-like /heat shock cognate 71 kDa protein-like /heat shock cognate 71 kDa protein-like /heat shock cognate 71 kDa protein-like /heat shock cognate 71 kDa protein-like /heat shock cognate 71 kDa protein-like /heat shock cognate 70 /heat shock cognate 70 /heat shock cognate 70 /heat shock cognate 70 /heat shock cognate 70 /heat shock cognate 70 /heat shock cognate 70 /heat shock cognate 70 /heat shock cognate 70 /heat shock cognate 70 /heat shock cognate 71 kDa protein-like /heat shock cognate 71 kDa protein-like /heat shock cognate 71 kDa protein-like /heat shock protein family A (Hsp70) member 1B /heat shock protein family A (Hsp70) member 8 /heat shock protein family A (Hsp70) member 8 /heat shock 70 kDa protein /heat shock cognate 71 kDa protein /heat shock cognate 71 kDa protein /heat shock cognate 71 kDa protein /heat shock cognate 71 kDa protein /heat shock cognate 71 kDa protein /heat shock cognate 71 kDa protein /heat shock cognate 71 kDa protein /heat shock 70 kDa protein 1 /heat shock protein family A (Hsp70) member 8 /heat shock cognate 70 kDa protein-like /heat shock cognate 70 kDa protein-like /heat shock cognate 70 kDa protein-like /heat shock cognate 70 kDa protein-like /heat shock cognate 70 kDa protein-like /heat shock cognate 70 kDa protein-like /heat shock cognate 70 kDa protein-like /heat shock cognate 70 kDa protein-like /heat shock cognate 70 kDa protein-like /heat shock cognate 70 kDa protein-like /heat shock cognate 70 kDa protein-like /heat shock protein family A (Hsp70) member 8 /heat shock protein family A (Hsp70) member 8 /heat shock protein family A (Hsp70) member 8 /heat shock protein family A (Hsp70) member 8b /heat shock protein family A (Hsp70) member 8b /heat shock protein family A (Hsp70) member 8b /heat shock protein family A (Hsp70) member 8b /heat shock cognate 71 kDa protein /heat shock cognate 71 kDa protein /heat shock protein family A (Hsp70) member 2 /heat shock cognate 70 kDa protein /heat shock cognate 70 kDa protein /heat shock cognate 70 kDa protein-like /heat shock cognate 70 kDa protein-like /heat shock protein family A (Hsp70) member 8b /heat shock protein family A (Hsp70) member 8b /heat shock protein family A (Hsp70) member 8b /heat shock protein family A (Hsp70) member 8b /heat shock protein family A (Hsp70) member 8b /heat shock protein family A (Hsp70) member 8b /heat shock protein family A (Hsp70) member 8b /heat shock protein family A (Hsp70) member 8b /heat shock protein family A (Hsp70) member 8b /heat shock cognate 71 kDa protein /heat shock cognate 71 kDa protein /heat shock cognate 71 kDa protein /heat shock cognate 71 kDa protein /heat shock cognate 71 kDa protein /heat shock cognate 71 kDa protein /heat shock cognate 71 kDa protein /heat shock cognate 71 kDa protein /heat shock cognate 71 kDa protein /heat shock cognate 71 kDa protein /heat shock cognate 71 kDa protein /heat shock cognate 70 /heat shock cognate 70 /heat shock cognate 70 /heat shock cognate 70 /heat shock cognate 70 /heat shock protein family A (Hsp70) member 1B /heat shock protein family A (Hsp70) member 8 /heat shock protein family A (Hsp70) member 8 /heat shock cognate 71 kDa protein-like /heat shock cognate 71 kDa protein-like /heat shock protein family A (Hsp70) member 8 /heat shock protein family A (Hsp70) member 8 /heat shock protein family A (Hsp70) member 1B /heat shock cognate 71 kDa protein /heat shock cognate 71 kDa protein /heat shock cognate 71 kDa protein /heat shock cognate 71 kDa protein /heat shock cognate 71 kDa protein /heat shock cognate 71 kDa protein /heat shock cognate 71 kDa protein /heat shock cognate 71 kDa protein /heat shock cognate 71 kDa protein /heat shock cognate 71 kDa protein /heat shock cognate 70 /heat shock cognate 70 /heat shock cognate 70 /heat shock cognate 70 /heat shock cognate 70 /heat shock protein family A (Hsp70) member 1B /heat shock cognate 71 kDa protein-like /heat shock cognate 71 kDa protein-like /heat shock cognate 71 kDa protein-like /heat shock cognate 71 kDa protein-like /heat shock cognate 71 kDa protein-like /heat shock cognate 71 kDa protein-like /heat shock cognate 71 kDa protein-like /heat shock cognate 71 kDa protein-like /heat shock cognate 71 kDa protein-like /heat shock cognate 71 kDa protein-like /heat shock cognate 70 /heat shock cognate 70 /heat shock cognate 70 /heat shock cognate 70 /heat shock cognate 70 /heat shock cognate 70 /heat shock cognate 70 /heat shock cognate 70 /heat shock cognate 70 /heat shock cognate 70 /heat shock 70 kDa protein 1 /heat shock 70 kDa protein-like /heat shock cognate 71 kDa protein-like /heat shock cognate 71 kDa protein-like /heat shock cognate 71 kDa protein-like /heat shock cognate 71 kDa protein-like /heat shock cognate 71 kDa protein-like /heat shock cognate 71 kDa protein-like /heat shock cognate 71 kDa protein-like /heat shock cognate 71 kDa protein-like /heat shock cognate 71 kDa protein-like /heat shock cognate 71 kDa protein-like /heat shock cognate 70 kDa protein /heat shock cognate 70 kDa protein /heat shock cognate 70 kDa protein /heat shock cognate 70 kDa protein /heat shock cognate 70 kDa protein /heat shock cognate 70 kDa protein /heat shock cognate 70 kDa protein /heat shock cognate 70 kDa protein /heat shock cognate 70 kDa protein /heat shock cognate 70 kDa protein /heat shock protein family A (Hsp70) member 8 /heat shock protein family A (Hsp70) member 8 /heat shock protein family A (Hsp70) member 8 /heat shock protein family A (Hsp70) member 8 /heat shock protein family A (Hsp70) member 8 /heat shock protein family A (Hsp70) member 8 /heat shock protein family A (Hsp70) member 8 /heat shock protein family A (Hsp70) member 8 /heat shock protein family A (Hsp70) member 8 /heat shock protein family A (Hsp70) member 8 /heat shock protein family A (Hsp70) member 8 /heat shock cognate 71 kDa protein /heat shock protein family A (Hsp70) member 2 /heat shock cognate 70 /heat shock cognate 70 kDa protein ",83,Ciona_intestinalis_ENSCING00000005686.3
1,OG0000214,dnaJ homolog subfamily B member 1-like /dnaJ homolog subfamily B member 1-like /DnaJ heat shock protein family (Hsp40) member B1a /dnaJ homolog subfamily B member 1-like /DnaJ heat shock protein family (Hsp40) member B13 /DnaJ heat shock protein family (Hsp40) member B5 /DnaJ heat shock protein family (Hsp40) member B5 /DnaJ heat shock protein family (Hsp40) member B5 /DnaJ heat shock protein family (Hsp40) member B5 /zgc:122979 /zgc:122979 /zgc:122979 /dnaJ homolog subfamily B member 1-like /dnaJ homolog subfamily B member 1-like /DnaJ heat shock protein family (Hsp40) member B1 /dnaJ homolog subfamily B member 4-like /dnaJ homolog subfamily B member 1-like /DnaJ heat shock protein family (Hsp40) member B1b /DnaJ heat shock protein family (Hsp40) member B13 /DnaJ heat shock protein family (Hsp40) member B13 /DnaJ heat shock protein family (Hsp40) member B13 /DnaJ heat shock protein family (Hsp40) member B13 /DnaJ heat shock protein family (Hsp40) member B13 /DnaJ heat shock protein family (Hsp40) member B1b /dnaJ homolog subfamily B member 5-like /dnaJ homolog subfamily B member 5-like /DnaJ heat shock protein family (Hsp40) member B1 /DnaJ heat shock protein family (Hsp40) member B13 /DnaJ heat shock protein family (Hsp40) member B13 /DnaJ heat shock protein family (Hsp40) member B13 /zgc:122979 /DnaJ heat shock protein family (Hsp40) member B5 /DnaJ heat shock protein family (Hsp40) member B13 /DnaJ heat shock protein family (Hsp40) member B13 /DnaJ heat shock protein family (Hsp40) member B4 /dnaJ homolog subfamily B member 13-like /dnaJ homolog subfamily B member 13-like /dnaJ homolog subfamily B member 13-like /dnaJ homolog subfamily B member 13-like /dnaJ homolog subfamily B member 5 /DnaJ heat shock protein family (Hsp40) member B13 /DnaJ heat shock protein family (Hsp40) member B13 /DnaJ heat shock protein family (Hsp40) member B13 /DnaJ heat shock protein family (Hsp40) member B13 /DnaJ heat shock protein family (Hsp40) member B13 /DnaJ heat shock protein family (Hsp40) member B13 /DnaJ heat shock protein family (Hsp40) member B5 /dnaJ homolog subfamily B member 1-like /dnaJ homolog subfamily B member 1-like /DnaJ heat shock protein family (Hsp40) member B1 /DnaJ heat shock protein family (Hsp40) member B5 /dnaJ homolog subfamily B member 5-like /DnaJ heat shock protein family (Hsp40) member B13 /DnaJ heat shock protein family (Hsp40) member B13 /DnaJ heat shock protein family (Hsp40) member B5 /dnaJ homolog subfamily B member 5-like /DnaJ heat shock protein family (Hsp40) member B1 /DnaJ heat shock protein family (Hsp40) member B4 /DnaJ heat shock protein family (Hsp40) member B4 /dnaJ homolog subfamily B member 5 /dnaJ homolog subfamily B member 5 /dnaJ homolog subfamily B member 5 /dnaJ homolog subfamily B member 5 /zgc:122979 /dnaJ homolog subfamily B member 1-like /DnaJ heat shock protein family (Hsp40) member B13 /DnaJ heat shock protein family (Hsp40) member B1b /DnaJ heat shock protein family (Hsp40) member B1b /DnaJ heat shock protein family (Hsp40) member B1b /DnaJ heat shock protein family (Hsp40) member B1b /DnaJ heat shock protein family (Hsp40) member B1b /dnaJ homolog subfamily B member 1-like /dnaJ homolog subfamily B member 5-like /DnaJ heat shock protein family (Hsp40) member B5 /DnaJ heat shock protein family (Hsp40) member B13 /DnaJ heat shock protein family (Hsp40) member B5 /DnaJ heat shock protein family (Hsp40) member B4 /dnaJ homolog subfamily B member 1 /DnaJ heat shock protein family (Hsp40) member B1b /zgc:122979 /DnaJ heat shock protein family (Hsp40) member B13 /DnaJ heat shock protein family (Hsp40) member B13 /DnaJ heat shock protein family (Hsp40) member B13 /dnaJ homolog subfamily B member 1-like /DnaJ heat shock protein family (Hsp40) member B4 /zgc:122979 /zgc:122979 /zgc:122979 /zgc:122979 /zgc:122979 /zgc:122979 /zgc:122979 /DnaJ heat shock protein family (Hsp40) member B1b /DnaJ heat shock protein family (Hsp40) member B4 /DnaJ heat shock protein family (Hsp40) member B1 /DnaJ heat shock protein family (Hsp40) member B13 /DnaJ heat shock protein family (Hsp40) member B1 /DnaJ heat shock protein family (Hsp40) member B1 /DnaJ heat shock protein family (Hsp40) member B1 /dnaJ homolog subfamily B member 5-like /DnaJ heat shock protein family (Hsp40) member B1b /DnaJ heat shock protein family (Hsp40) member B1b /dnaJ homolog subfamily B member 1-like /dnaJ homolog subfamily B member 1-like /DnaJ heat shock protein family (Hsp40) member B4 /DnaJ heat shock protein family (Hsp40) member B13 /DnaJ heat shock protein family (Hsp40) member B1a /DnaJ heat shock protein family (Hsp40) member B4 /dnaJ homolog subfamily B member 13-like /dnaJ homolog subfamily B member 4-like /dnaJ homolog subfamily B member 1-like /dnaJ homolog subfamily B member 1-like /zgc:122979 /DnaJ heat shock protein family (Hsp40) member B5 /DnaJ heat shock protein family (Hsp40) member B13 /DnaJ heat shock protein family (Hsp40) member B4 /DnaJ heat shock protein family (Hsp40) member B4 /DnaJ heat shock protein family (Hsp40) member B1a /DnaJ heat shock protein family (Hsp40) member B1a /dnaJ homolog subfamily B member 5-like ,84,Ciona_intestinalis_ENSCING00000001452.3
2,OG0000570,"heat shock protein, alpha-crystallin-related, b11 /heat shock protein, alpha-crystallin-related, b11 /heat shock protein 30-like /heat shock protein beta-11-like /heat shock protein, alpha-crystallin-related, b11 /heat shock protein beta-11-like /heat shock protein beta-11-like /heat shock protein beta-11 /body wall muscle protein HR-29-like /heat shock protein, alpha-crystallin-related, b11 /heat shock protein, alpha-crystallin-related, b11 /heat shock protein, alpha-crystallin-related, b11 /heat shock protein beta-11-like /heat shock protein, alpha-crystallin-related, b11 /heat shock protein 30-like /heat shock protein, alpha-crystallin-related, b11 /heat shock protein, alpha-crystallin-related, b11 /heat shock protein, alpha-crystallin-related, b11 /heat shock protein beta-11-like /Esox lucius heat shock protein beta-11 (LOC105014744), mRNA. /heat shock protein 30-like /heat shock protein, alpha-crystallin-related, b11 /heat shock protein, alpha-crystallin-related, b11 /heat shock protein, alpha-crystallin-related, b11 /heat shock protein beta-11-like /heat shock protein beta-11-like /heat shock protein 30C-like /heat shock protein, alpha-crystallin-related, b11 /heat shock protein, alpha-crystallin-related, b11 /heat shock protein, alpha-crystallin-related, b11 /heat shock protein, alpha-crystallin-related, b11 /heat shock protein beta-11-like /heat shock protein, alpha-crystallin-related, b11 /heat shock protein, alpha-crystallin-related, b11 /heat shock protein, alpha-crystallin-related, b11 /heat shock protein, alpha-crystallin-related, b11 /heat shock protein, alpha-crystallin-related, b11 /heat shock protein, alpha-crystallin-related, b11 /heat shock protein, alpha-crystallin-related, b11 /heat shock protein beta-11-like /heat shock protein beta-11-like /heat shock protein beta-11-like /heat shock protein, alpha-crystallin-related, b11 /heat shock protein 30-like /heat shock protein, alpha-crystallin-related, b11 /heat shock protein beta-11-like /heat shock protein, alpha-crystallin-related, b11 /heat shock protein beta-11-like /heat shock protein, alpha-crystallin-related, b11 /heat shock protein, alpha-crystallin-related, b11 /heat shock protein 30-like ",82,Ciona_intestinalis_ENSCING00000024613.1
3,OG0000915,dnaJ homolog subfamily B member 6-like /DnaJ heat shock protein family (Hsp40) member B6 /DnaJ heat shock protein family (Hsp40) member B2 /DnaJ heat shock protein family (Hsp40) member B2 /DnaJ heat shock protein family (Hsp40) member B6b /DnaJ heat shock protein family (Hsp40) member B6b /DnaJ heat shock protein family (Hsp40) member B6 /DnaJ heat shock protein family (Hsp40) member B6b /DnaJ heat shock protein family (Hsp40) member B6 /DnaJ heat shock protein family (Hsp40) member B6 /DnaJ heat shock protein family (Hsp40) member B6 /dnaJ homolog subfamily B member 6-like /dnaJ homolog subfamily B member 6-like /dnaJ homolog subfamily B member 6-like /dnaJ homolog subfamily B member 6-like /DnaJ heat shock protein family (Hsp40) member B6b /DnaJ heat shock protein family (Hsp40) member B6 /DnaJ heat shock protein family (Hsp40) member B6 /DnaJ heat shock protein family (Hsp40) member B6 /DnaJ heat shock protein family (Hsp40) member B6b /DnaJ heat shock protein family (Hsp40) member B6b /DnaJ heat shock protein family (Hsp40) member B6b /DnaJ heat shock protein family (Hsp40) member B6b /DnaJ heat shock protein family (Hsp40) member B6a /DnaJ heat shock protein family (Hsp40) member B6a /dnaJ homolog subfamily B member 6-like /dnaJ homolog subfamily B member 6-like /dnaJ homolog subfamily B member 6-like /dnaJ homolog subfamily B member 6-B-like /DnaJ heat shock protein family (Hsp40) member B6 /DnaJ heat shock protein family (Hsp40) member B6 /DnaJ heat shock protein family (Hsp40) member B2 /DnaJ heat shock protein family (Hsp40) member B2 /DnaJ heat shock protein family (Hsp40) member B2 /DnaJ heat shock protein family (Hsp40) member B6b /DnaJ heat shock protein family (Hsp40) member B6b /DnaJ heat shock protein family (Hsp40) member B6b /dnaJ homolog subfamily B member 6-like /DnaJ heat shock protein family (Hsp40) member B2 /dnaJ homolog subfamily B member 6-like /DnaJ heat shock protein family (Hsp40) member B6b /DnaJ heat shock protein family (Hsp40) member B6b /dnaJ homolog subfamily B member 6-like /dnaJ homolog subfamily B member 6-like /DnaJ heat shock protein family (Hsp40) member B6a /DnaJ heat shock protein family (Hsp40) member B2 /DnaJ heat shock protein family (Hsp40) member B2 /dnaJ homolog subfamily B member 6 /dnaJ homolog subfamily B member 6-like /DnaJ heat shock protein family (Hsp40) member B2 /DnaJ heat shock protein family (Hsp40) member B2 /DnaJ heat shock protein family (Hsp40) member B6b /DnaJ heat shock protein family (Hsp40) member B6 /DnaJ heat shock protein family (Hsp40) member B6b /DnaJ heat shock protein family (Hsp40) member B6 /dnaJ homolog subfamily B member 6-like /DnaJ heat shock protein family (Hsp40) member B2 /DnaJ heat shock protein family (Hsp40) member B2 /DnaJ heat shock protein family (Hsp40) member B6b /DnaJ heat shock protein family (Hsp40) member B6b /dnaJ homolog subfamily B member 6 /DnaJ heat shock protein family (Hsp40) member B6b /DnaJ heat shock protein family (Hsp40) member B6 /DnaJ heat shock protein family (Hsp40) member B2 /DnaJ heat shock protein family (Hsp40) member B2 /DnaJ heat shock protein family (Hsp40) member B6b /DnaJ heat shock protein family (Hsp40) member B2 /DnaJ heat shock protein family (Hsp40) member B6 /DnaJ heat shock protein family (Hsp40) member B2 /DnaJ heat shock protein family (Hsp40) member B6 /DnaJ heat shock protein family (Hsp40) member B6 /DnaJ heat shock protein family (Hsp40) member B6 /dnaJ homolog subfamily B member 6-like /dnaJ homolog subfamily B member 6-like /dnaJ homolog subfamily B member 6-like /dnaJ homolog subfamily B member 6-like /dnaJ homolog subfamily B member 6-like /DnaJ heat shock protein family (Hsp40) member B6 /DnaJ heat shock protein family (Hsp40) member B2 /dnaJ homolog subfamily B member 6-like /dnaJ homolog subfamily B member 6-like /DnaJ heat shock protein family (Hsp40) member B2 /dnaJ homolog subfamily B member 6-like /dnaJ homolog subfamily B member 6-like /dnaJ homolog subfamily B member 6-like /DnaJ heat shock protein family (Hsp40) member B6 /DnaJ heat shock protein family (Hsp40) member B6a /DnaJ heat shock protein family (Hsp40) member B6b /dnaJ homolog subfamily B member 6-like ,83,Ciona_intestinalis_ENSCING00000011510.2
